{
  "$schema": "https://raw.githubusercontent.com/saifeldeen911/actionfence/main/schemas/guard-policy.schema.json",
  "service": "BookFlight.com",
  "version": "1.0",
  "default_rule": "deny",
  "actions": {
    "search_flights": {
      "allowed": true,
      "identity": "token"
    },
    "book_flight": {
      "allowed": true,
      "identity": "verified",
      "max_spend": 500,
      "currency": "USD",
      "requires_human_approval": true
    },
    "check_status": {
      "allowed": true,
      "identity": "token"
    },
    "bulk_booking": {
      "allowed": false
    }
  },
  "rate_limits": {
    "requests_per_minute": 30,
    "transactions_per_day": 5
  },
  "spend_limits": {
    "session_max": 1000,
    "daily_max": 2500,
    "currency": "USD"
  },
  "regulations": [
    "EU_AI_Act_Art50"
  ]
}
