{
  "$schema": "https://raw.githubusercontent.com/saifeldeen911/actionfence/main/schemas/guard-policy.schema.json",
  "service": "TestService",
  "version": "1.0",
  "default_rule": "deny",
  "actions": {
    "search_flights": {
      "allowed": true,
      "identity": "any"
    },
    "book_flight": {
      "allowed": true,
      "identity": "verified",
      "max_spend": 500.5,
      "requires_human_approval": true
    },
    "read_prices": {
      "allowed": true,
      "identity": "token"
    },
    "bulk_booking": {
      "allowed": false
    }
  },
  "rate_limits": {
    "requests_per_minute": 30,
    "transactions_per_day": 5
  },
  "spend_limits": {
    "session_max": 1000,
    "daily_max": 2500.75,
    "currency": "USD"
  },
  "regulations": ["EU_AI_Act_Art50"]
}
